

================================================================
== Vitis HLS Report for 'write_attn_matmul_v_Pipeline_ln403_for_each_patch_ln405_for_block_dim'
================================================================
* Date:           Wed Jul 31 17:01:22 2024

* Version:        2022.2 (Build 3670227 on Oct 13 2022)
* Project:        Deit_cpp
* Solution:       solution1 (Vivado IP Flow Target)
* Product family: zynquplus
* Target device:  xck26-sfvc784-2LV-c


================================================================
== Performance Estimates
================================================================
+ Timing: 
    * Summary: 
    +--------+----------+----------+------------+
    |  Clock |  Target  | Estimated| Uncertainty|
    +--------+----------+----------+------------+
    |ap_clk  |  10.00 ns|  7.300 ns|     2.70 ns|
    +--------+----------+----------+------------+

+ Latency: 
    * Summary: 
    +---------+---------+-----------+-----------+------+------+---------+
    |  Latency (cycles) |   Latency (absolute)  |   Interval  | Pipeline|
    |   min   |   max   |    min    |    max    |  min |  max |   Type  |
    +---------+---------+-----------+-----------+------+------+---------+
    |     3099|     3099|  30.990 us|  30.990 us|  3099|  3099|       no|
    +---------+---------+-----------+-----------+------+------+---------+

    + Detail: 
        * Instance: 
        N/A

        * Loop: 
        +----------------------------------------------+---------+---------+----------+-----------+-----------+------+----------+
        |                                              |  Latency (cycles) | Iteration|  Initiation Interval  | Trip |          |
        |                   Loop Name                  |   min   |   max   |  Latency |  achieved |   target  | Count| Pipelined|
        +----------------------------------------------+---------+---------+----------+-----------+-----------+------+----------+
        |- _ln403_for_each_patch__ln405_for_block_dim  |     3097|     3097|         3|          1|          1|  3096|       yes|
        +----------------------------------------------+---------+---------+----------+-----------+-----------+------+----------+

============================================================
+ Verbose Summary: Synthesis Manager
============================================================
InlineROM: 1
ExposeGlobal: 0
============================================================
+ Verbose Summary: CDFG Model
============================================================
IsTopModel: 0
ResetActiveHigh: 1
IsCombinational: 0
IsDatapathOnly: 0
HasWiredReturn: 1
HasMFsm: 2
HasVarLatency: 1
IsPipeline: 0
IsRtlPipelined: 0
IsInstanceOverlapped: 0
IsDontTouch: 0
HasImplIP: 0
IsGatedGlobalClock: 0

+ Individual pipeline summary: 
  * Pipeline-0: initiation interval (II) = 1, depth = 3


============================================================
+ Verbose Summary: Schedule
============================================================
* Number of FSM states : 3
* Pipeline : 1
  Pipeline-0 : II = 1, D = 3, States = { 1 2 3 }
* Dataflow Pipeline: 0

* FSM state transitions: 
1 --> 2 
2 --> 3 
3 --> 

* FSM state operations: 

State 1 <SV = 0> <Delay = 1.40>
ST_1 : Operation 6 [1/1] (0.00ns)   --->   "%indvar_flatten = alloca i32 1"   --->   Operation 6 'alloca' 'indvar_flatten' <Predicate = true> <Delay = 0.00>
ST_1 : Operation 7 [1/1] (0.00ns)   --->   "%sext_ln403_read = read i59 @_ssdm_op_Read.ap_auto.i59, i59 %sext_ln403"   --->   Operation 7 'read' 'sext_ln403_read' <Predicate = true> <Delay = 0.00>
ST_1 : Operation 8 [1/1] (0.00ns)   --->   "%sext_ln403_cast = sext i59 %sext_ln403_read"   --->   Operation 8 'sext' 'sext_ln403_cast' <Predicate = true> <Delay = 0.00>
ST_1 : Operation 9 [1/1] (0.00ns)   --->   "%specinterface_ln0 = specinterface void @_ssdm_op_SpecInterface, i256 %inout1, void @empty_6, i32 0, i32 0, void @empty_24, i32 0, i32 1, void @empty_14, void @empty_7, void @empty_24, i32 16, i32 16, i32 16, i32 16, void @empty_24, void @empty_24, i32 4294967295, i32 0"   --->   Operation 9 'specinterface' 'specinterface_ln0' <Predicate = true> <Delay = 0.00>
ST_1 : Operation 10 [1/1] (0.00ns)   --->   "%specinterface_ln0 = specinterface void @_ssdm_op_SpecInterface, i256 %attn_matmul_v_stream, void @empty_71, i32 0, i32 0, void @empty_24, i32 0, i32 0, void @empty_24, void @empty_24, void @empty_24, i32 0, i32 0, i32 0, i32 0, void @empty_24, void @empty_24, i32 4294967295, i32 0"   --->   Operation 10 'specinterface' 'specinterface_ln0' <Predicate = true> <Delay = 0.00>
ST_1 : Operation 11 [1/1] (0.42ns)   --->   "%store_ln0 = store i12 0, i12 %indvar_flatten"   --->   Operation 11 'store' 'store_ln0' <Predicate = true> <Delay = 0.42>
ST_1 : Operation 12 [1/1] (0.00ns)   --->   "%br_ln0 = br void %for.inc"   --->   Operation 12 'br' 'br_ln0' <Predicate = true> <Delay = 0.00>
ST_1 : Operation 13 [1/1] (0.00ns)   --->   "%indvar_flatten_load = load i12 %indvar_flatten" [Deit_cpp/src/attention.cpp:403]   --->   Operation 13 'load' 'indvar_flatten_load' <Predicate = true> <Delay = 0.00>
ST_1 : Operation 14 [1/1] (0.97ns)   --->   "%icmp_ln403 = icmp_eq  i12 %indvar_flatten_load, i12 3096" [Deit_cpp/src/attention.cpp:403]   --->   Operation 14 'icmp' 'icmp_ln403' <Predicate = true> <Delay = 0.97> <CoreInst = "Cmp">   --->   Core 9 'Cmp' <Latency = 0> <II = 1> <Delay = 0.97> <FuncUnit> <Opcode : 'icmp'> <InPorts = 2> <OutPorts = 1>
ST_1 : Operation 15 [1/1] (0.80ns)   --->   "%add_ln403 = add i12 %indvar_flatten_load, i12 1" [Deit_cpp/src/attention.cpp:403]   --->   Operation 15 'add' 'add_ln403' <Predicate = true> <Delay = 0.80> <CoreInst = "Adder">   --->   Core 1 'Adder' <Latency = 0> <II = 1> <Delay = 0.80> <FuncUnit> <Opcode : 'add' 'sub'> <InPorts = 2> <OutPorts = 1>
ST_1 : Operation 16 [1/1] (0.00ns)   --->   "%br_ln403 = br i1 %icmp_ln403, void %for.inc7, void %for.end9.exitStub" [Deit_cpp/src/attention.cpp:403]   --->   Operation 16 'br' 'br_ln403' <Predicate = true> <Delay = 0.00>
ST_1 : Operation 17 [1/1] (0.42ns)   --->   "%store_ln405 = store i12 %add_ln403, i12 %indvar_flatten" [Deit_cpp/src/attention.cpp:405]   --->   Operation 17 'store' 'store_ln405' <Predicate = (!icmp_ln403)> <Delay = 0.42>

State 2 <SV = 1> <Delay = 1.83>
ST_2 : Operation 18 [1/1] (0.00ns)   --->   "%inout1_addr = getelementptr i256 %inout1, i64 %sext_ln403_cast" [Deit_cpp/src/attention.cpp:403]   --->   Operation 18 'getelementptr' 'inout1_addr' <Predicate = true> <Delay = 0.00>
ST_2 : Operation 19 [1/1] (1.83ns)   --->   "%attn_matmul_v_stream_read = read i256 @_ssdm_op_Read.ap_fifo.volatile.i256P0A, i256 %attn_matmul_v_stream" [Deit_cpp/src/attention.cpp:409]   --->   Operation 19 'read' 'attn_matmul_v_stream_read' <Predicate = (!icmp_ln403)> <Delay = 1.83> <CoreInst = "FIFO_SRL">   --->   Core 81 'FIFO_SRL' <Latency = 0> <II = 1> <Delay = 1.83> <Storage> <Opcode : 'read' 'write' 'nbread' 'nbwrite'> <Ports = 0> <Width = 256> <Depth = 2> <FIFO>
ST_2 : Operation 26 [1/1] (0.00ns)   --->   "%ret_ln0 = ret"   --->   Operation 26 'ret' 'ret_ln0' <Predicate = (icmp_ln403)> <Delay = 0.00>

State 3 <SV = 2> <Delay = 7.30>
ST_3 : Operation 20 [1/1] (0.00ns)   --->   "%specloopname_ln0 = specloopname void @_ssdm_op_SpecLoopName, void @p_ln403_for_each_patch_ln405_for_block_dim_str"   --->   Operation 20 'specloopname' 'specloopname_ln0' <Predicate = true> <Delay = 0.00>
ST_3 : Operation 21 [1/1] (0.00ns)   --->   "%speclooptripcount_ln0 = speclooptripcount void @_ssdm_op_SpecLoopTripCount, i64 3096, i64 3096, i64 3096"   --->   Operation 21 'speclooptripcount' 'speclooptripcount_ln0' <Predicate = true> <Delay = 0.00>
ST_3 : Operation 22 [1/1] (0.00ns)   --->   "%specpipeline_ln407 = specpipeline void @_ssdm_op_SpecPipeline, i32 4294967295, i32 0, i32 0, i32 0, void @empty_24" [Deit_cpp/src/attention.cpp:407]   --->   Operation 22 'specpipeline' 'specpipeline_ln407' <Predicate = true> <Delay = 0.00>
ST_3 : Operation 23 [1/1] (0.00ns)   --->   "%specloopname_ln405 = specloopname void @_ssdm_op_SpecLoopName, void @empty_45" [Deit_cpp/src/attention.cpp:405]   --->   Operation 23 'specloopname' 'specloopname_ln405' <Predicate = true> <Delay = 0.00>
ST_3 : Operation 24 [1/1] (7.30ns)   --->   "%write_ln409 = write void @_ssdm_op_Write.m_axi.p1i256, i256 %inout1_addr, i256 %attn_matmul_v_stream_read, i32 4294967295" [Deit_cpp/src/attention.cpp:409]   --->   Operation 24 'write' 'write_ln409' <Predicate = true> <Delay = 7.30> <CoreInst = "m_axi">   --->   Core 121 'm_axi' <Latency = 0> <II = 1> <Delay = 1.00> <Adapter> <Opcode : 'read' 'write' 'readreq' 'writereq' 'writeresp'>
ST_3 : Operation 25 [1/1] (0.00ns)   --->   "%br_ln405 = br void %for.inc" [Deit_cpp/src/attention.cpp:405]   --->   Operation 25 'br' 'br_ln405' <Predicate = true> <Delay = 0.00>


============================================================
+ Verbose Summary: Timing violations
============================================================
Target clock period: 10ns, clock uncertainty: 2.7ns.

 <State 1>: 1.4ns
The critical path consists of the following:
	'alloca' operation ('indvar_flatten') [4]  (0 ns)
	'load' operation ('indvar_flatten_load', Deit_cpp/src/attention.cpp:403) on local variable 'indvar_flatten' [12]  (0 ns)
	'add' operation ('add_ln403', Deit_cpp/src/attention.cpp:403) [15]  (0.809 ns)
	'store' operation ('store_ln405', Deit_cpp/src/attention.cpp:405) of variable 'add_ln403', Deit_cpp/src/attention.cpp:403 on local variable 'indvar_flatten' [24]  (0.427 ns)
	blocking operation 0.167 ns on control path)

 <State 2>: 1.84ns
The critical path consists of the following:
	fifo read operation ('attn_matmul_v_stream_read', Deit_cpp/src/attention.cpp:409) on port 'attn_matmul_v_stream' (Deit_cpp/src/attention.cpp:409) [22]  (1.84 ns)

 <State 3>: 7.3ns
The critical path consists of the following:
	bus write operation ('write_ln409', Deit_cpp/src/attention.cpp:409) on port 'inout1' (Deit_cpp/src/attention.cpp:409) [23]  (7.3 ns)


============================================================
+ Verbose Summary: Binding
============================================================
N/A
* FSMD analyzer results:
  - Output states:
 - Input state : 
  - Chain level:
	State 1
	State 2
	State 3


============================================================
+ Verbose Summary: Datapath Resource usage 
============================================================
N/A
